{
  "entries": [
    {"authority_relevance":"reviewed_non_authority","capability_class":"in_memory_construction","evidence_source":"rust_standard_library","id":"external-policy:rust.btree-map-new","language":"rust","reason_code":"standard_library_in_memory_value","semantic_kinds":["data_only"],"signature":"BTreeMap::new"},
    {"authority_relevance":"reviewed_non_authority","capability_class":"in_memory_construction","evidence_source":"rust_standard_library","id":"external-policy:rust.btree-set-new","language":"rust","reason_code":"standard_library_in_memory_value","semantic_kinds":["data_only"],"signature":"BTreeSet::new"},
    {"authority_relevance":"reviewed_non_authority","capability_class":"in_memory_construction","evidence_source":"rust_core_or_prelude","id":"external-policy:rust.err","language":"rust","reason_code":"language_value_constructor","semantic_kinds":["data_only"],"signature":"Err"},
    {"authority_relevance":"reviewed_non_authority","capability_class":"in_memory_construction","evidence_source":"rust_standard_library","id":"external-policy:rust.hash-map-new","language":"rust","reason_code":"standard_library_in_memory_value","semantic_kinds":["data_only"],"signature":"HashMap::new"},
    {"authority_relevance":"reviewed_non_authority","capability_class":"in_memory_construction","evidence_source":"rust_standard_library","id":"external-policy:rust.hash-set-new","language":"rust","reason_code":"standard_library_in_memory_value","semantic_kinds":["data_only"],"signature":"HashSet::new"},
    {"authority_relevance":"reviewed_non_authority","capability_class":"in_memory_construction","evidence_source":"rust_core_or_prelude","id":"external-policy:rust.ok","language":"rust","reason_code":"language_value_constructor","semantic_kinds":["data_only"],"signature":"Ok"},
    {"authority_relevance":"reviewed_non_authority","capability_class":"in_memory_construction","evidence_source":"rust_standard_library","id":"external-policy:rust.ref-cell-new","language":"rust","reason_code":"standard_library_in_memory_value","semantic_kinds":["data_only"],"signature":"RefCell::new"},
    {"authority_relevance":"reviewed_non_authority","capability_class":"in_memory_construction","evidence_source":"rust_core_or_prelude","id":"external-policy:rust.some","language":"rust","reason_code":"language_value_constructor","semantic_kinds":["data_only"],"signature":"Some"},
    {"authority_relevance":"reviewed_non_authority","capability_class":"in_memory_construction","evidence_source":"rust_standard_library","id":"external-policy:rust.string-new","language":"rust","reason_code":"standard_library_in_memory_value","semantic_kinds":["data_only"],"signature":"String::new"},
    {"authority_relevance":"reviewed_non_authority","capability_class":"in_memory_construction","evidence_source":"rust_standard_library","id":"external-policy:rust.vec-new","language":"rust","reason_code":"standard_library_in_memory_value","semantic_kinds":["data_only"],"signature":"Vec::new"},
    {"authority_relevance":"reviewed_non_authority","capability_class":"assertion","evidence_source":"rust_core_or_prelude","id":"external-policy:rust.assert","language":"rust","reason_code":"language_assertion","semantic_kinds":["data_only"],"signature":"assert"},
    {"authority_relevance":"reviewed_non_authority","capability_class":"assertion","evidence_source":"rust_core_or_prelude","id":"external-policy:rust.assert-eq","language":"rust","reason_code":"language_assertion","semantic_kinds":["data_only"],"signature":"assert_eq"},
    {"authority_relevance":"reviewed_non_authority","capability_class":"assertion","evidence_source":"rust_core_or_prelude","id":"external-policy:rust.assert-ne","language":"rust","reason_code":"language_assertion","semantic_kinds":["data_only"],"signature":"assert_ne"},
    {"authority_relevance":"reviewed_non_authority","capability_class":"assertion","evidence_source":"rust_core_or_prelude","id":"external-policy:rust.debug-assert","language":"rust","reason_code":"language_assertion","semantic_kinds":["data_only"],"signature":"debug_assert"},
    {"authority_relevance":"reviewed_non_authority","capability_class":"assertion","evidence_source":"rust_core_or_prelude","id":"external-policy:rust.matches","language":"rust","reason_code":"language_assertion","semantic_kinds":["data_only"],"signature":"matches"},
    {"authority_relevance":"reviewed_non_authority","capability_class":"assertion","evidence_source":"rust_core_or_prelude","id":"external-policy:rust.panic","language":"rust","reason_code":"language_assertion","semantic_kinds":["data_only"],"signature":"panic"},
    {"authority_relevance":"reviewed_non_authority","capability_class":"assertion","evidence_source":"swift_xctest","id":"external-policy:swift.xct-assert-equal","language":"swift","reason_code":"test_assertion","semantic_kinds":["data_only"],"signature":"XCTAssertEqual"},
    {"authority_relevance":"reviewed_non_authority","capability_class":"assertion","evidence_source":"swift_xctest","id":"external-policy:swift.xct-assert-false","language":"swift","reason_code":"test_assertion","semantic_kinds":["data_only"],"signature":"XCTAssertFalse"},
    {"authority_relevance":"reviewed_non_authority","capability_class":"assertion","evidence_source":"swift_xctest","id":"external-policy:swift.xct-assert-nil","language":"swift","reason_code":"test_assertion","semantic_kinds":["data_only"],"signature":"XCTAssertNil"},
    {"authority_relevance":"reviewed_non_authority","capability_class":"assertion","evidence_source":"swift_xctest","id":"external-policy:swift.xct-assert-true","language":"swift","reason_code":"test_assertion","semantic_kinds":["data_only"],"signature":"XCTAssertTrue"}
  ],
  "policy_semantic_digest": "c71c5efafc1d120bbfae677a2e966824377b2bcb6482996609d5090ca138ccc6",
  "policy_status": "p3_machine_validated_review_pending",
  "schema": "decodex/lane-authority-v2-external-symbol-policy/1"
}
